{
  "report_id": "3771046b-9cf7-42d9-9b94-dd882e9acd46",
  "framework_version": "2.0.0",
  "timestamp": "2026-09-16T10:15:03.224092+00:00",
  "pipeline_id": "pipeline-20260916-101502",
  "assessments": {
    "training_data_integrity": {
      "findings": [
        {
          "finding_id": "82b2d4d2",
          "module": "data_integrity",
          "attack_class": "near_duplicate_flooding",
          "severity": "MEDIUM",
          "confidence": 0.9706,
          "title": "Near-duplicate image clusters detected",
          "description": "80 images form 2 near-duplicate clusters (cosine sim >= 0.95).",
          "evidence": {
            "near_cluster_count": 2,
            "total_near_duplicates": 80,
            "similarity_threshold": 0.95,
            "clusters": [
              {
                "cluster_root": "80671",
                "size": 77,
                "contributors": {
                  "unknown": 77
                },
                "sample_ids": [
                  "397133",
                  "296649",
                  "386912",
                  "289393",
                  "17627",
                  "143931",
                  "322864",
                  "153299",
                  "308394",
                  "456496"
                ]
              },
              {
                "cluster_root": "180135",
                "size": 3,
                "contributors": {
                  "unknown": 3
                },
                "sample_ids": [
                  "122745",
                  "85329",
                  "180135"
                ]
              }
            ]
          },
          "affected_assets": [
            "397133",
            "296649",
            "386912",
            "289393",
            "17627",
            "143931",
            "322864",
            "153299",
            "308394",
            "456496",
            "184321",
            "565778",
            "555705",
            "443303",
            "418281",
            "25560",
            "329323",
            "511321",
            "314294",
            "233771",
            "185250",
            "356427",
            "572517",
            "270244",
            "430961",
            "577539",
            "104612",
            "486438",
            "400573",
            "109798",
            "370677",
            "369370",
            "502737",
            "37777",
            "174482",
            "403385",
            "6818",
            "458054",
            "331352",
            "502136",
            "491497",
            "184791",
            "348881",
            "522713",
            "181666",
            "303818",
            "460347",
            "226111",
            "41888",
            "297343",
            "239274",
            "286994",
            "475779",
            "516316",
            "562121",
            "360661",
            "16228",
            "266409",
            "476258",
            "448365",
            "35197",
            "349860",
            "238866",
            "252219",
            "480985",
            "463730",
            "336587",
            "301867",
            "125211",
            "382088",
            "87038",
            "219578",
            "500663",
            "312421",
            "58636",
            "403817",
            "80671",
            "122745",
            "85329",
            "180135"
          ],
          "disposition": "review",
          "remediation": "Review near-duplicate clusters.  Keep the highest-quality version and remove others to avoid biasing the model.",
          "timestamp": "2026-09-16T10:15:02.371046+00:00"
        },
        {
          "finding_id": "5da15a2c",
          "module": "data_integrity",
          "attack_class": "near_duplicate_flooding",
          "severity": "HIGH",
          "confidence": 1.0,
          "title": "Suspected duplicate flooding by contributor 'unknown'",
          "description": "Contributor 'unknown' dominates 80 duplicate samples out of 80 total contributions (100.0%), suggesting intentional flooding.",
          "evidence": {
            "contributor": "unknown",
            "duplicate_count": 80,
            "total_from_contributor": 80,
            "duplicate_rate": 1.0
          },
          "affected_assets": [
            "397133",
            "37777",
            "252219",
            "87038",
            "174482",
            "403385",
            "6818",
            "480985",
            "458054",
            "331352",
            "296649",
            "386912",
            "502136",
            "491497",
            "184791",
            "348881",
            "289393",
            "522713",
            "181666",
            "17627",
            "143931",
            "303818",
            "463730",
            "460347",
            "322864",
            "226111",
            "153299",
            "308394",
            "456496",
            "58636",
            "41888",
            "184321",
            "565778",
            "297343",
            "336587",
            "122745",
            "219578",
            "555705",
            "443303",
            "500663",
            "418281",
            "25560",
            "403817",
            "85329",
            "329323",
            "239274",
            "286994",
            "511321",
            "314294",
            "233771",
            "475779",
            "301867",
            "312421",
            "185250",
            "356427",
            "572517",
            "270244",
            "516316",
            "125211",
            "562121",
            "360661",
            "16228",
            "382088",
            "266409",
            "430961",
            "80671",
            "577539",
            "104612",
            "476258",
            "448365",
            "35197",
            "349860",
            "180135",
            "486438",
            "400573",
            "109798",
            "370677",
            "238866",
            "369370",
            "502737"
          ],
          "disposition": "quarantine",
          "remediation": "Audit all submissions from 'unknown'. Rate-limit future contributions and require diversity checks.",
          "timestamp": "2026-09-16T10:15:02.371077+00:00"
        },
        {
          "finding_id": "2f8347d7",
          "module": "data_integrity",
          "attack_class": "ood_insertion",
          "severity": "MEDIUM",
          "confidence": 0.6429,
          "title": "Out-of-distribution samples detected",
          "description": "7 sample(s) flagged as OOD: 1 flagged by both detectors, 3 by Mahalanobis only, 3 by Isolation Forest only.",
          "evidence": {
            "total_flagged": 7,
            "both_detectors": 1,
            "mahalanobis_only": 3,
            "isolation_forest_only": 3,
            "contamination": 0.05,
            "mahalanobis_threshold": 78.3874,
            "per_sample_scores": {
              "181666": {
                "mahalanobis_distance": 78.8859,
                "isolation_score": 0.461,
                "flagged_by": "mahalanobis"
              },
              "460347": {
                "mahalanobis_distance": 74.7654,
                "isolation_score": 0.5202,
                "flagged_by": "isolation_forest"
              },
              "297343": {
                "mahalanobis_distance": 78.509,
                "isolation_score": 0.4878,
                "flagged_by": "mahalanobis"
              },
              "122745": {
                "mahalanobis_distance": 76.9027,
                "isolation_score": 0.5402,
                "flagged_by": "isolation_forest"
              },
              "360661": {
                "mahalanobis_distance": 78.8684,
                "isolation_score": 0.4458,
                "flagged_by": "mahalanobis"
              },
              "266409": {
                "mahalanobis_distance": 78.8382,
                "isolation_score": 0.504,
                "flagged_by": "both"
              },
              "80671": {
                "mahalanobis_distance": 78.1771,
                "isolation_score": 0.5273,
                "flagged_by": "isolation_forest"
              }
            },
            "contributors": {
              "unknown": 7
            }
          },
          "affected_assets": [
            "181666",
            "460347",
            "297343",
            "122745",
            "360661",
            "266409",
            "80671"
          ],
          "disposition": "quarantine",
          "remediation": "Inspect flagged samples for relevance to the target domain. Remove confirmed OOD samples. Investigate contributing sources for intentional insertion.",
          "timestamp": "2026-09-16T10:15:02.413136+00:00"
        }
      ],
      "finding_count": 3,
      "module_summaries": {
        "patch_triggers": {
          "ran": true,
          "finding_count": 0
        },
        "spectral_signatures": {
          "ran": true,
          "finding_count": 0
        },
        "label_integrity": {
          "ran": true,
          "finding_count": 0
        },
        "duplicates": {
          "ran": true,
          "finding_count": 2
        },
        "ood": {
          "ran": true,
          "finding_count": 1
        }
      },
      "source_risks": {
        "unknown": {
          "type": "contributor",
          "total_samples": 80,
          "finding_count": 167,
          "risk_score": 7.0537,
          "risk_level": "CRITICAL",
          "attack_classes": [
            "ood_insertion",
            "near_duplicate_flooding"
          ]
        }
      },
      "overall_risk": "HIGH",
      "timestamp": "2026-09-16T10:15:02.413355+00:00"
    },
    "model_integrity": {
      "access_level": "white-box",
      "checks_performed": [
        "weight_analysis",
        "entropy_probe"
      ],
      "checks_skipped": [
        {
          "check": "neural_cleanse",